{
  "brief": "G1V2",
  "connections": [
    {
      "endpoints": [
        {
          "instance": "usb",
          "port": "VBUS"
        },
        {
          "instance": "protection",
          "port": "VIN"
        }
      ],
      "net": "USB_VBUS"
    },
    {
      "endpoints": [
        {
          "instance": "protection",
          "port": "VOUT"
        },
        {
          "instance": "ldo",
          "port": "VIN"
        }
      ],
      "net": "PROTECTED_5V"
    },
    {
      "endpoints": [
        {
          "instance": "ldo",
          "port": "VOUT"
        },
        {
          "instance": "monitor",
          "port": "VDD"
        },
        {
          "instance": "monitor",
          "port": "SENSE_IN"
        }
      ],
      "net": "REGULATED_3V3"
    },
    {
      "endpoints": [
        {
          "instance": "monitor",
          "port": "SENSE_OUT"
        },
        {
          "instance": "mcu",
          "port": "VDD"
        },
        {
          "instance": "swd",
          "port": "VREF"
        },
        {
          "instance": "power_led",
          "port": "DRIVE"
        },
        {
          "instance": "button",
          "port": "VDD"
        },
        {
          "instance": "i2c",
          "port": "VDD"
        },
        {
          "instance": "eeprom",
          "port": "VDD"
        },
        {
          "instance": "i2c_header",
          "port": "VDD"
        },
        {
          "instance": "bridge",
          "port": "PWR3V3"
        }
      ],
      "net": "LOGGER_3V3"
    },
    {
      "endpoints": [
        {
          "instance": "usb",
          "port": "GND"
        },
        {
          "instance": "protection",
          "port": "GND"
        },
        {
          "instance": "ldo",
          "port": "GND"
        },
        {
          "instance": "monitor",
          "port": "GND"
        },
        {
          "instance": "mcu",
          "port": "GND"
        },
        {
          "instance": "swd",
          "port": "GND"
        },
        {
          "instance": "power_led",
          "port": "GND"
        },
        {
          "instance": "user_led1",
          "port": "GND"
        },
        {
          "instance": "user_led2",
          "port": "GND"
        },
        {
          "instance": "button",
          "port": "GND"
        },
        {
          "instance": "eeprom",
          "port": "GND"
        },
        {
          "instance": "i2c_header",
          "port": "GND"
        },
        {
          "instance": "bridge",
          "port": "GND"
        }
      ],
      "net": "GND"
    },
    {
      "endpoints": [
        {
          "instance": "mcu",
          "port": "SWDIO"
        },
        {
          "instance": "swd",
          "port": "SWDIO"
        }
      ],
      "net": "SWDIO"
    },
    {
      "endpoints": [
        {
          "instance": "mcu",
          "port": "SWCLK"
        },
        {
          "instance": "swd",
          "port": "SWCLK"
        }
      ],
      "net": "SWCLK"
    },
    {
      "endpoints": [
        {
          "instance": "mcu",
          "port": "NRST"
        },
        {
          "instance": "swd",
          "port": "NRST"
        }
      ],
      "net": "NRST"
    },
    {
      "endpoints": [
        {
          "instance": "mcu",
          "port": "LED1"
        },
        {
          "instance": "user_led1",
          "port": "DRIVE"
        }
      ],
      "net": "USER_LED1"
    },
    {
      "endpoints": [
        {
          "instance": "mcu",
          "port": "LED2"
        },
        {
          "instance": "user_led2",
          "port": "DRIVE"
        }
      ],
      "net": "USER_LED2"
    },
    {
      "endpoints": [
        {
          "instance": "mcu",
          "port": "BUTTON"
        },
        {
          "instance": "button",
          "port": "SIGNAL"
        }
      ],
      "net": "USER_BUTTON"
    },
    {
      "endpoints": [
        {
          "instance": "mcu",
          "port": "SDA"
        },
        {
          "instance": "monitor",
          "port": "SDA"
        },
        {
          "instance": "i2c",
          "port": "SDA"
        },
        {
          "instance": "eeprom",
          "port": "SDA"
        },
        {
          "instance": "i2c_header",
          "port": "SDA"
        }
      ],
      "net": "I2C_SDA"
    },
    {
      "endpoints": [
        {
          "instance": "mcu",
          "port": "SCL"
        },
        {
          "instance": "monitor",
          "port": "SCL"
        },
        {
          "instance": "i2c",
          "port": "SCL"
        },
        {
          "instance": "eeprom",
          "port": "SCL"
        },
        {
          "instance": "i2c_header",
          "port": "SCL"
        }
      ],
      "net": "I2C_SCL"
    },
    {
      "endpoints": [
        {
          "instance": "mcu",
          "port": "UART_TX"
        },
        {
          "instance": "bridge",
          "port": "UART_RX"
        }
      ],
      "net": "UART_TX"
    },
    {
      "endpoints": [
        {
          "instance": "mcu",
          "port": "UART_RX"
        },
        {
          "instance": "bridge",
          "port": "UART_TX"
        }
      ],
      "net": "UART_RX"
    },
    {
      "endpoints": [
        {
          "instance": "usb",
          "port": "USB_DP"
        },
        {
          "instance": "bridge",
          "port": "USB_DP"
        }
      ],
      "net": "USB_DP"
    },
    {
      "endpoints": [
        {
          "instance": "usb",
          "port": "USB_DN"
        },
        {
          "instance": "bridge",
          "port": "USB_DN"
        }
      ],
      "net": "USB_DN"
    }
  ],
  "id": "G1V2-reference",
  "instances": [
    {
      "block": "block:usb-c-usb2-sink",
      "id": "usb",
      "parameters": {
        "output_current": {
          "basis": "ENGINEERING_DEFAULT",
          "conditions": {},
          "note": "Owner decision D7.",
          "unit": "A",
          "value": 0.5
        },
        "output_voltage": {
          "basis": "ENGINEERING_DEFAULT",
          "conditions": {},
          "note": "Original synthetic G1 design requirement.",
          "unit": "V",
          "value": 5
        },
        "resistance": {
          "basis": "ENGINEERING_DEFAULT",
          "conditions": {},
          "note": "Owner decision D7.",
          "unit": "ohm",
          "value": 5100
        }
      },
      "ports": [
        {
          "name": "VBUS",
          "type": "POWER_OUT"
        },
        {
          "name": "GND",
          "type": "GROUND"
        },
        {
          "name": "USB_DP",
          "type": "BIDIRECTIONAL"
        },
        {
          "name": "USB_DN",
          "type": "BIDIRECTIONAL"
        }
      ],
      "requirements": [
        "usb_sink",
        "usb"
      ]
    },
    {
      "block": "block:input-protection",
      "id": "protection",
      "parameters": {},
      "ports": [
        {
          "name": "VIN",
          "type": "POWER_IN"
        },
        {
          "name": "VOUT",
          "type": "POWER_OUT"
        },
        {
          "name": "GND",
          "type": "GROUND"
        }
      ],
      "requirements": [
        "input_protection"
      ]
    },
    {
      "block": "block:ldo-fixed",
      "id": "ldo",
      "parameters": {
        "output_current": {
          "basis": "ENGINEERING_DEFAULT",
          "conditions": {},
          "note": "Owner decision D7.",
          "unit": "A",
          "value": 0.15
        },
        "output_voltage": {
          "basis": "ENGINEERING_DEFAULT",
          "conditions": {},
          "note": "Original synthetic G1 design requirement.",
          "unit": "V",
          "value": 3.3
        }
      },
      "ports": [
        {
          "name": "VIN",
          "type": "POWER_IN"
        },
        {
          "name": "VOUT",
          "type": "POWER_OUT"
        },
        {
          "name": "GND",
          "type": "GROUND"
        }
      ],
      "requirements": [
        "regulation"
      ]
    },
    {
      "block": "block:ina219-monitor",
      "id": "monitor",
      "parameters": {},
      "ports": [
        {
          "name": "VDD",
          "type": "POWER_IN"
        },
        {
          "name": "SENSE_IN",
          "type": "POWER_IN"
        },
        {
          "name": "SENSE_OUT",
          "type": "POWER_OUT"
        },
        {
          "name": "GND",
          "type": "GROUND"
        },
        {
          "name": "SDA",
          "type": "BIDIRECTIONAL"
        },
        {
          "name": "SCL",
          "type": "INPUT"
        }
      ],
      "requirements": [
        "power_monitor",
        "monitor_scope"
      ]
    },
    {
      "block": "block:mcu-core",
      "id": "mcu",
      "parameters": {
        "clock_frequency": {
          "basis": "ENGINEERING_DEFAULT",
          "conditions": {},
          "note": "Owner decision D7.",
          "unit": "Hz",
          "value": 8000000
        }
      },
      "ports": [
        {
          "name": "VDD",
          "type": "POWER_IN"
        },
        {
          "name": "GND",
          "type": "GROUND"
        },
        {
          "name": "SWDIO",
          "type": "BIDIRECTIONAL"
        },
        {
          "name": "SWCLK",
          "type": "INPUT"
        },
        {
          "name": "NRST",
          "type": "BIDIRECTIONAL"
        },
        {
          "name": "LED1",
          "type": "OUTPUT"
        },
        {
          "name": "LED2",
          "type": "OUTPUT"
        },
        {
          "name": "BUTTON",
          "type": "INPUT"
        },
        {
          "name": "SDA",
          "type": "BIDIRECTIONAL"
        },
        {
          "name": "SCL",
          "type": "BIDIRECTIONAL"
        },
        {
          "name": "UART_TX",
          "type": "OUTPUT"
        },
        {
          "name": "UART_RX",